{
  "domain": "mobilitaetsreferat",
  "product": "radverkehr",
  "title": "Radverkehr Tageswerte München",
  "description": {
    "purpose": "Tägliche Radverkehrszahlen je Dauerzählstelle inkl. Wetter.",
    "usage": "Mobilitätsplanung, Monitoring, Open-Data-Veröffentlichung.",
    "limitations": "Nur Dauerzählstellen; Wetter aggregiert je Tag."
  },
  "owner": {
    "data_owner": "dateneigner.mobilitaet@muenchen.de",
    "data_steward": "steward.mobilitaet@muenchen.de",
    "contact": "open.data@muenchen.de"
  },
  "classification": "public",
  "update_frequency": "P1D",
  "personal_data": false,
  "open_data_candidate": true,
  "license": "https://www.govdata.de/dl-de/by-2-0",
  "spatial": "https://sws.geonames.org/2867714/",
  "govdata_category": ["http://publications.europa.eu/resource/authority/data-theme/TRAN"],
  "source": {
    "type": "file_export",
    "location": "data/sample_radverkehr_tageswerte_2025_01.csv"
  }
}
